{"artifact":{"evidence_type":"governed_artifact","path":"research_notes/m2_deliverable.md","root":{"discovery":"explicit:reviews/.harness/fixtures/terminal-m2/synthetic-project-manifest.json","identity":"c2-synthetic-project","kind":"project","manifest_sha256":"74d0a353e47d3b2087a34981ad1d1d75849fc50f97c4ff69b584a166853e60b9"},"sha256":"a4f408e50e83fab0ca89ddda2cff8e7779a38333dd34c1e9b7342bc5d4e4051e"},"authority_mode":"legacy_compatibility","canonical_bibliography_snapshot":{"evidence_type":"canonical_bibliography_snapshot","path":"reviews/.harness/fixtures/terminal-m2/canonical-bibliography-1.json","root":{"discovery":"explicit:reviews/.harness/fixtures/terminal-m2/synthetic-project-manifest.json","identity":"c2-synthetic-project","kind":"project","manifest_sha256":"74d0a353e47d3b2087a34981ad1d1d75849fc50f97c4ff69b584a166853e60b9"},"sha256":"e2f7b0125ac63bb46f2778436739805fc12b3f89a16b094d4b6a33c80219a8ee"},"canonical_extract_receipts":[{"evidence_type":"canonical_extract_receipt","path":"reviews/.harness/fixtures/terminal-m2/canonical-extract-2.json","root":{"discovery":"explicit:reviews/.harness/fixtures/terminal-m2/synthetic-project-manifest.json","identity":"c2-synthetic-project","kind":"project","manifest_sha256":"74d0a353e47d3b2087a34981ad1d1d75849fc50f97c4ff69b584a166853e60b9"},"sha256":"568fb9de2e47dda9255eed777160f3bf7f35da028dcee96a00bc6eeca6d78225"}],"centroid_packet":{"evidence_type":"centroid_packet","path":"reviews/.harness/fixtures/terminal-m2/synthetic-centroid-packet.json","root":{"discovery":"explicit:reviews/.harness/fixtures/terminal-m2/synthetic-project-manifest.json","identity":"c2-synthetic-project","kind":"project","manifest_sha256":"74d0a353e47d3b2087a34981ad1d1d75849fc50f97c4ff69b584a166853e60b9"},"sha256":"926ac1b800e60eb8276cc6d8d6df3cc206dcff1438344a3b3445c84eed160330"},"corpus_digest":"e2f7b0125ac63bb46f2778436739805fc12b3f89a16b094d4b6a33c80219a8ee","diagnostic_legacy_view":{"passages":[{"citation":{"authors":["Fixture, C."],"label":"2026","title":"Fixture centroid evidence","year":2026},"extract":{"path":"B:\\Agents\\platform\\co-author-harness\\full-run-valid-template-i9dfhfr1\\working\\p\\reviews\\.harness\\fixtures\\terminal-m2\\normalized.txt","sha256":"62260ccc2f6bcddf37f55f23d17d184493b2ba9ab17e3d9484d757b9f2ae5b87"},"extraction":{"canonical":true,"method":"pdftotext","tool":"pdftotext"},"locator":"p. 1","quote":"replayable evidence must bind exact","source":{"path":"B:\\Agents\\platform\\co-author-harness\\full-run-valid-template-i9dfhfr1\\working\\p\\miniature.pdf","sha256":"e21a489ac04667bc46d4335e604f6e6ba3fbfa27d8f473a96d0ebce9737a6c3a"},"source_key":"fixture-centroid-evidence","use":"Non-authoritative diagnostic compatibility quotation.","use_scope":"surface"}]},"member_coverage":[{"disposition":"included","member_role":"centroid","rationale":"Supplies the FINAL surface passage.","source_key":"fixture-centroid-evidence"},{"disposition":"omitted","member_role":"argument","rationale":"Not needed for the bounded fixture claim.","source_key":"fixture-argument-evidence"}],"passages":[{"canonical_extract_receipt":{"evidence_type":"canonical_extract_receipt","path":"reviews/.harness/fixtures/terminal-m2/canonical-extract-2.json","root":{"discovery":"explicit:reviews/.harness/fixtures/terminal-m2/synthetic-project-manifest.json","identity":"c2-synthetic-project","kind":"project","manifest_sha256":"74d0a353e47d3b2087a34981ad1d1d75849fc50f97c4ff69b584a166853e60b9"},"sha256":"568fb9de2e47dda9255eed777160f3bf7f35da028dcee96a00bc6eeca6d78225"},"citation":{"authors":["Fixture, C."],"label":"2026","source_key":"fixture-centroid-evidence","title":"Fixture centroid evidence","year":2026},"direct_quotation":{"text":"replayable evidence must bind exact"},"locator":{"normalized_end_utf8":102,"normalized_start_utf8":67,"occurrence":1,"page_end":1,"page_start":1,"text_sha256":"131b853e7975b40a40957c33d07a4db1cafbb2428b8251372b5c0f79fff1a1a4"},"manuscript_span":{"end_utf8":72,"start_utf8":37,"text_sha256":"131b853e7975b40a40957c33d07a4db1cafbb2428b8251372b5c0f79fff1a1a4"},"passage_use":"direct_quotation","source_key":"fixture-centroid-evidence","use_scope":"surface"},{"canonical_extract_receipt":{"evidence_type":"canonical_extract_receipt","path":"reviews/.harness/fixtures/terminal-m2/canonical-extract-2.json","root":{"discovery":"explicit:reviews/.harness/fixtures/terminal-m2/synthetic-project-manifest.json","identity":"c2-synthetic-project","kind":"project","manifest_sha256":"74d0a353e47d3b2087a34981ad1d1d75849fc50f97c4ff69b584a166853e60b9"},"sha256":"568fb9de2e47dda9255eed777160f3bf7f35da028dcee96a00bc6eeca6d78225"},"citation":{"authors":["Fixture, C."],"label":"2026","source_key":"fixture-centroid-evidence","title":"Fixture centroid evidence","year":2026},"evaluator_review":{"artifact_sha256":"a4f408e50e83fab0ca89ddda2cff8e7779a38333dd34c1e9b7342bc5d4e4051e","disposition":"accepted","influence_statement_sha256":"b8a190bfb4e7fba6c2cd2ba7579e31144b92a83fd19d5622f91de33e62d60430","manuscript_span_sha256":"d9c20121ca5f1b75bc0b1d1b6415ac23beb91bded1a8932229e3175b7455c321","review_type":"conditioning_influence_review","reviewer_role":"evaluator","schema_version":"1.0.0","source_passage_sha256":"d68381d6c998dc16427abfdb19020570c8f00f29746b0c38414099f413dd5672"},"influence_statement":"The source bounded the rationale claim.","locator":{"normalized_end_utf8":447,"normalized_start_utf8":394,"occurrence":1,"page_end":2,"page_start":2,"text_sha256":"d68381d6c998dc16427abfdb19020570c8f00f29746b0c38414099f413dd5672"},"manuscript_span":{"end_utf8":207,"start_utf8":135,"text_sha256":"d9c20121ca5f1b75bc0b1d1b6415ac23beb91bded1a8932229e3175b7455c321"},"passage_use":"conditioning_passage","source_key":"fixture-centroid-evidence","use_scope":"argument"}],"phase":"generation","policy":{"evidence_type":"draft_policy","path":"policy.json","root":{"discovery":"explicit:manifest.json","identity":"c2-synthetic-wiki","kind":"wiki","manifest_sha256":"4221125abecf155091593d6686c6512d54dd0219e041cd0b6672675af9d009a2"},"sha256":"d38bfae99c4b10de53a53d9134e33ef1b9eecda8a6b4d5b3224eea0c7dfbd8f1"},"receipt_type":"centroid_semantic_execution","role":"generator","schema_version":"3.0.0","semantic_assessment":{"actionable_findings":[],"deviations":[],"strengths":[],"summary":"Synthetic compatibility assertion only.","warrant_limits":["No genuine semantic judgment is claimed."]},"target":"FINAL"}
